Sheet: Script
A1: =MID( CELL("filename",R1C1),
FIND("[", CELL("filename",R1C1)) +1,
FIND("]", CELL("filename",R1C1)) - FIND("[", CELL("filename",R1C1)) -1) -> Location.xml
A4: index | B4: Id | C4: Description | D4: EventSituation | E4: Id
A5: 0 | B5: YorkCastle1 | C5: "オクスブリッジは大ヨークの北方に位置する。 北のデナンの山々の向こうには邪神が棲むとされ、 それを畏れて住民はみな石の壁の内側に住み、神学に意を注いでいる。" | D5: None
A6: =R[-1]C+1 -> 1 | B6: YorkTown1 | C6: "ノージャフはジエラー半島の付け根の、小都市である。 ここに住む人はみな、漁をして暮らしている。 南には穏やかな海、北には荒々しい海があり、食卓はいつも様々な魚であふれている。" | D6: None
A7: =R[-1]C+1 -> 2 | B7: YorkTown2 | C7: "大ヨークの西の果てに、小さな村、ダーナーがある。南にはトレウパ大陸を望む。 人々の騒ぎ声に腹を立てた神が、斧によって、大ヨークを大陸から切り離した、という言い伝えがあるので、 ここの住民は息を潜めるように暮らしていて、栄えることがない。" | D7: None
A8: =R[-1]C+1 -> 3 | B8: YorkCity1 | C8: "サウスポートは海沿いで、歴史は浅いが、巨大な都市である。 手の器用な漁網編みの女たちが、東の大陸から運ばれてくる絹糸を最高の工芸品にして、 南の大陸へ送り出す。私はその船に乗り、トレウパ大陸へ向かった。" | D8: Warp | E8: YorkToGerden
A9: =R[-1]C+1 -> 4 | B9: GerdenCastle1 | C9: "船で南行すること五日で、トレウパ大陸ゲーデン国の北の港湾都市、 ノルドウファブルグ＝デレステインに到着する。 良質の石を運ぶ川が街中に流れている。 東の大陸への定期船はなく、私有船を手に入れねばなるまい。" | D9: None
A10: =R[-1]C+1 -> 5 | B10: GerdenTown1 | C10: "ストリューブールは、東のゲーデンと西のフロニアの間で争われている街である。 山脈のすぐそばにあるので、西の大国フロニアが占領しても、その後の補給が続かない。 山越えをする季節ではなかったので、最初の滞在ではフロニアへは行かなかった。 | D10: None
A11: =R[-1]C+1 -> 6 | B11: GerdenTown2 | C11: "ステルジムは、トレウパ大陸の北端の都市である。 海の向こうのダーナーとは違って、ここの人々はみな偶像教徒なので、 神を恐れることはなく、貿易で仕入れた酒で騒がしく暮らしている。" | D11: None
A12: =R[-1]C+1 -> 7 | B12: GerdenTown3 | C12: "ドレシャワという都市が、トレウパ大陸の北東に位置している。 かつてはたいへん立派な都市だったが、 シャデル川を越えて攻め入ってきたゲーデン国の騎士たちに、すっかり荒らされてしまった。 特に見るところもないので、私は一度大ヨークへ戻ることにした。" | D12: Warp | E12: GerdenToYork
A13: =R[-1]C+1 -> 8 | B13: GerdenTown4 | C13: "リュクリャヴァは、大霊峰のふもとの街である。 大霊峰に足を踏み入れれば、家族もろとも魂を抜かれて気が狂うと言われているので、 これより先に住む者はいない。" | D13: None
A14: =R[-1]C+1 -> 9 | B14: GerdenCity1 | C14: "アラは、トレウパ大陸の南の果ての大都市である。 ここで私はついに船を手に入れ、陸央海の航行を始めた。" | D14: Unlock | E14: Ship
A15: =R[-1]C+1 -> 10 | B15: IsleTown1 | C15: "キクレ島は、陸中海の南部に浮かんでいる。 ゲーデンの迫害から逃れた、邪教信徒らが身を寄せ合って暮らしている。" | D15: None
A16: =R[-1]C+1 -> 11 | B16: IsleTown2 | C16: "アグアランドは、大ヨークの南西の島の中央の都市である。 サウスポートの隆盛に合わせて、ここの人々も技術を蓄えている。" | D16: None
A17: =R[-1]C+1 -> 12 | B17: ZenqTown1 | C17: "ゼンクー大陸の南の山合いに、テリズという小さな町がある。 そばを流れる大河を使った灌漑が容易にできるので、 ここの人々は食べることに困ることがない。 | D17: None
A18: =R[-1]C+1 -> 13 | B18: ZenqTown2 | C18: "デュカンベは、ゼンクーの東の都市である。 住民はみな精霊教徒であるから、よく他の国から攻め入られるのだが、 男はたくましく、女もしたたかであるから、 今も滅びずに残っている。" | D18: None
A19: =R[-1]C+1 -> 14 | B19: ZenqTown3 | C19: "ガヴァルカンドは、エングリ高原の、風光明媚な村である。 ここの人は、みな誰もが、馬と、牛と、羊と、犬を持っている。 短い草は、家畜たちの良い餌になる。" | D19: None
A20: =R[-1]C+1 -> 15 | B20: ZenqCity1 | C20: "アサダバードは、ニロネ川のほとりの、たいへんな大都市である。 大河の恵みを受けて、麦が大変よく育つのだが、しばしば氾濫もする。 人々はみな邪教を信じていて、生きた人の臓を取り出すことで、 川の神の怒りを収めようとしている。 | D20: None
A21: =R[-1]C+1 -> 16 | B21: ZenqCity2 | C21: "テネチネティランは、ゼンクー大陸の中央に位置する。 ナナララ湖の水運は全て彼らに独占されていて、 私もカヌーを借りることができなかったので、 ゼンクー大陸東部へは北を周っていかねばならなかった。 | D21: None
A22: =R[-1]C+1 -> 17 | B22: ZenqCastle1 | C22: "シェンナイは大きい集落だが、あなた方が知っている大都市とは少し違う。 我々の知っている鉄の道具はないし、かと思えば、見たことのない石の建物がある。 私は名前の知らない石の乗り物で、東ゼンクーへ移動した。" | D22: Warp | E22: ToWestZenq

Sheet: 凡例
C1: SePath
C2: Sound/SE/